{
  "schemaVersion": 1,
  "id": "fa-ir-g1",
  "status": "draft",
  "language": "fa",
  "region": "IR",
  "grade": 1,
  "cellSize": 6,
  "direction": "print-to-braille",
  "version": "0.1.0",
  "ruleIds": [
    "FA-G1-DIGIT-ARABIC-INDIC-000",
    "FA-G1-DIGIT-ARABIC-INDIC-001",
    "FA-G1-DIGIT-ARABIC-INDIC-002",
    "FA-G1-DIGIT-ARABIC-INDIC-003",
    "FA-G1-DIGIT-ARABIC-INDIC-004",
    "FA-G1-DIGIT-ARABIC-INDIC-005",
    "FA-G1-DIGIT-ARABIC-INDIC-006",
    "FA-G1-DIGIT-ARABIC-INDIC-007",
    "FA-G1-DIGIT-ARABIC-INDIC-008",
    "FA-G1-DIGIT-ARABIC-INDIC-009",
    "FA-G1-DIGIT-ASCII-000",
    "FA-G1-DIGIT-ASCII-001",
    "FA-G1-DIGIT-ASCII-002",
    "FA-G1-DIGIT-ASCII-003",
    "FA-G1-DIGIT-ASCII-004",
    "FA-G1-DIGIT-ASCII-005",
    "FA-G1-DIGIT-ASCII-006",
    "FA-G1-DIGIT-ASCII-007",
    "FA-G1-DIGIT-ASCII-008",
    "FA-G1-DIGIT-ASCII-009",
    "FA-G1-DIGIT-PERSIAN-000",
    "FA-G1-DIGIT-PERSIAN-001",
    "FA-G1-DIGIT-PERSIAN-002",
    "FA-G1-DIGIT-PERSIAN-003",
    "FA-G1-DIGIT-PERSIAN-004",
    "FA-G1-DIGIT-PERSIAN-005",
    "FA-G1-DIGIT-PERSIAN-006",
    "FA-G1-DIGIT-PERSIAN-007",
    "FA-G1-DIGIT-PERSIAN-008",
    "FA-G1-DIGIT-PERSIAN-009",
    "FA-G1-LATIN-001",
    "FA-G1-LATIN-002",
    "FA-G1-LATIN-003",
    "FA-G1-LATIN-004",
    "FA-G1-LATIN-005",
    "FA-G1-LATIN-006",
    "FA-G1-LATIN-007",
    "FA-G1-LATIN-008",
    "FA-G1-LATIN-009",
    "FA-G1-LATIN-010",
    "FA-G1-LATIN-011",
    "FA-G1-LATIN-012",
    "FA-G1-LATIN-013",
    "FA-G1-LATIN-014",
    "FA-G1-LATIN-015",
    "FA-G1-LATIN-016",
    "FA-G1-LATIN-017",
    "FA-G1-LATIN-018",
    "FA-G1-LATIN-019",
    "FA-G1-LATIN-020",
    "FA-G1-LATIN-021",
    "FA-G1-LATIN-022",
    "FA-G1-LATIN-023",
    "FA-G1-LATIN-024",
    "FA-G1-LATIN-025",
    "FA-G1-LATIN-026",
    "FA-G1-LATIN-027",
    "FA-G1-LATIN-028",
    "FA-G1-LATIN-029",
    "FA-G1-LATIN-030",
    "FA-G1-LATIN-031",
    "FA-G1-LATIN-032",
    "FA-G1-LATIN-033",
    "FA-G1-LATIN-034",
    "FA-G1-LATIN-035",
    "FA-G1-LATIN-036",
    "FA-G1-LATIN-037",
    "FA-G1-LATIN-038",
    "FA-G1-LATIN-039",
    "FA-G1-LATIN-040",
    "FA-G1-LATIN-041",
    "FA-G1-LATIN-042",
    "FA-G1-LATIN-043",
    "FA-G1-LATIN-044",
    "FA-G1-LATIN-045",
    "FA-G1-LATIN-046",
    "FA-G1-LATIN-047",
    "FA-G1-LATIN-048",
    "FA-G1-LATIN-049",
    "FA-G1-LATIN-050",
    "FA-G1-LATIN-051",
    "FA-G1-LATIN-052",
    "FA-G1-LATIN-MODE-001",
    "FA-G1-LATIN-MODE-002",
    "FA-G1-LATIN-MODE-003",
    "FA-G1-LATIN-MODE-004",
    "FA-G1-LAYOUT-001",
    "FA-G1-LAYOUT-002",
    "FA-G1-LAYOUT-003",
    "FA-G1-LAYOUT-004",
    "FA-G1-LAYOUT-005",
    "FA-G1-LAYOUT-006",
    "FA-G1-LAYOUT-007",
    "FA-G1-LAYOUT-008",
    "FA-G1-LAYOUT-009",
    "FA-G1-LAYOUT-010",
    "FA-G1-LAYOUT-011",
    "FA-G1-LAYOUT-012",
    "FA-G1-LAYOUT-013",
    "FA-G1-LAYOUT-014",
    "FA-G1-LAYOUT-015",
    "FA-G1-LAYOUT-016",
    "FA-G1-LAYOUT-017",
    "FA-G1-LAYOUT-018",
    "FA-G1-LAYOUT-019",
    "FA-G1-LAYOUT-020",
    "FA-G1-LAYOUT-021",
    "FA-G1-LAYOUT-022",
    "FA-G1-LAYOUT-023",
    "FA-G1-LAYOUT-024",
    "FA-G1-LAYOUT-025",
    "FA-G1-LAYOUT-026",
    "FA-G1-LAYOUT-027",
    "FA-G1-LETTER-001",
    "FA-G1-LETTER-002",
    "FA-G1-LETTER-003",
    "FA-G1-LETTER-004",
    "FA-G1-LETTER-005",
    "FA-G1-LETTER-006",
    "FA-G1-LETTER-007",
    "FA-G1-LETTER-008",
    "FA-G1-LETTER-009",
    "FA-G1-LETTER-010",
    "FA-G1-LETTER-011",
    "FA-G1-LETTER-012",
    "FA-G1-LETTER-013",
    "FA-G1-LETTER-014",
    "FA-G1-LETTER-015",
    "FA-G1-LETTER-016",
    "FA-G1-LETTER-017",
    "FA-G1-LETTER-018",
    "FA-G1-LETTER-019",
    "FA-G1-LETTER-020",
    "FA-G1-LETTER-021",
    "FA-G1-LETTER-022",
    "FA-G1-LETTER-023",
    "FA-G1-LETTER-024",
    "FA-G1-LETTER-025",
    "FA-G1-LETTER-026",
    "FA-G1-LETTER-027",
    "FA-G1-LETTER-028",
    "FA-G1-LETTER-029",
    "FA-G1-LETTER-030",
    "FA-G1-LETTER-031",
    "FA-G1-LETTER-032",
    "FA-G1-NORM-ZWNJ-001",
    "FA-G1-NUM-FRACTION-SLASH-001",
    "FA-G1-NUMRULE-001",
    "FA-G1-NUMRULE-002",
    "FA-G1-NUMRULE-003",
    "FA-G1-NUMRULE-004",
    "FA-G1-NUMRULE-005",
    "FA-G1-NUMRULE-006",
    "FA-G1-NUMRULE-007",
    "FA-G1-ORTHO-EZAFE-SEQUENCE-001",
    "FA-G1-ORTHO-SUPERSCRIPT-ALEF-001",
    "FA-G1-PUNC-ASTERISK-RUN-001",
    "FA-G1-PUNC-ASTERISK-SINGLE-001",
    "FA-G1-PUNC-ELLIPSIS-001",
    "FA-G1-PUNC-SCALAR-001",
    "FA-G1-PUNC-SCALAR-002",
    "FA-G1-PUNC-SCALAR-003",
    "FA-G1-PUNC-SCALAR-004",
    "FA-G1-PUNC-SCALAR-005",
    "FA-G1-PUNC-SCALAR-006",
    "FA-G1-PUNC-SCALAR-007",
    "FA-G1-PUNC-SCALAR-008",
    "FA-G1-PUNC-SCALAR-009",
    "FA-G1-PUNC-SCALAR-010",
    "FA-G1-PUNC-SCALAR-011",
    "FA-G1-PUNC-SCALAR-016",
    "FA-G1-PUNC-SCALAR-017",
    "FA-G1-PUNC-SCALAR-019",
    "FA-G1-PUNC-SCALAR-020",
    "FA-G1-PUNC-UNICODE-ELLIPSIS-001"
  ],
  "normalizationPolicy": {
    "unicodeForm": "none",
    "unknownFormatControls": "error"
  },
  "fallbackPolicy": {
    "unknownCharacter": "error",
    "unknownSequence": "error"
  },
  "evidenceBaseline": {
    "masterDecisionMatrix": "spec/fa-ir/evidence/master-decision-matrix.json",
    "minimumClassification": "REVIEW-REQUIRED"
  }
}
